span,n.,跨度；持续时间,作名词时，如time span（时间跨度）；span of control（管理幅度）；作动词时，如span three decades（跨越三十年），在历史、管理类文章中常见,His career spanned decades.,发音近似死盼，可以联想：死死盼着一段时间跨度（span）结束，或者盼着跨越（span）某个距离
spare,v./adj.,节省；备用的,作形容词时，如spare time（空闲时间）；spare parts（备用零件）；作动词时，如spare no effort（不遗余力）；spare sb.（饶恕某人），在生活、科技类文章中常见,Can you spare a minute?,谐音四掰儿——四个掰下来的是多余的，所以spare是多余的、抽出
schedule,n./v.,日程；安排,作名词时，如daily schedule（日程表）；flight schedule（航班时刻表）；作动词时，如schedule a meeting（安排会议），在生活、商业类文章中高频出现,The event is scheduled for May.,schedule发音近似死盖就，可以编个小逻辑：事情死盖就（必须按计划来），就得看日程表（schedule）
scheme,n./v.,计划；方案；密谋,作名词时，可指计划（如a training scheme（培训计划））；也可指阴谋（如a dishonest scheme（欺诈阴谋））；作动词时，如scheme to do sth.（策划做某事），在商业、政治类文章中常见,They schemed to take control.,谐音斯计么——斯文人的计策，就是计划、阴谋
science,n.,科学,常指科学（如modern science（现代科学））；也可指学科（如social sciences（社会科学）），是基础词汇，在各类科技、学术文章中高频出现,He loves science.,谐音赛因斯——赛过因斯坦的学科，就是科学、学科
scientific,adj.,科学的,常修饰方法、研究、态度等，如scientific method（科学方法）；scientific research（科学研究），在科技、学术类文章中高频出现,She aspired to a scientific career.,science（科学）+ific——科学的，就是科学的、严谨的
scientist,n.,科学家,常与具体领域搭配，如a nuclear scientist（核科学家）；environmental scientists（环境科学家），在科技、学术类文章中常见,She’s a research scientist.,science（科学）+ist（表人）——搞科学的人，就是科学家
